{
  "id": "icml-2026",
  "name": "ICML",
  "fullName": "International Conference on Machine Learning",
  "year": 2026,
  "field": "LEARNING",
  "tags": [
    "machine-learning",
    "deep-learning",
    "ai"
  ],
  "deadline": "2026-01-28",
  "location": "Seoul, Korea",
  "website": "https://icml.cc",
  "weight": 20,
  "featured": true,
  "updatedAt": "2026-07-30"
}
