{
  "id": "eccv-2026",
  "name": "ECCV",
  "fullName": "European Conference on Computer Vision",
  "year": 2026,
  "field": "VISION",
  "tags": [
    "computer-vision",
    "deep-learning"
  ],
  "deadline": "2026-03-06",
  "location": "Malmö, Sweden",
  "website": "https://eccv.ecva.net",
  "weight": 10,
  "featured": false,
  "updatedAt": "2026-07-30"
}
