{
  "id": "aistats-2027",
  "name": "AISTATS",
  "fullName": "International Conference on Artificial Intelligence and Statistics",
  "year": 2027,
  "field": "LEARNING",
  "tags": [
    "statistics",
    "machine-learning"
  ],
  "deadline": "2026-10-02",
  "location": "Naha, Japan",
  "website": "https://aistats.org",
  "weight": 7,
  "featured": false,
  "updatedAt": "2026-07-30"
}
