{
  "id": "kdd-2027",
  "name": "KDD",
  "fullName": "ACM SIGKDD Conference on Knowledge Discovery and Data Mining",
  "year": 2027,
  "field": "DATA",
  "tags": [
    "data-mining",
    "machine-learning",
    "databases"
  ],
  "deadline": "2026-07-26",
  "abstractDeadline": "2026-07-19",
  "location": "San Jose, USA",
  "website": "https://kdd2027.kdd.org",
  "weight": 10,
  "featured": true,
  "updatedAt": "2026-07-30"
}
