{
  "id": "eurographics-2027",
  "name": "EUROGRAPHICS",
  "fullName": "Annual Conference of the European Association for Computer Graphics",
  "year": 2027,
  "field": "GRAPHICS",
  "tags": [
    "graphics",
    "rendering",
    "visualization"
  ],
  "deadline": "2026-10-09",
  "location": "Lyon, France",
  "website": "https://eg.org",
  "weight": 5,
  "featured": false,
  "updatedAt": "2026-07-30"
}
