{
  "id": "neurips-2026",
  "name": "NEURIPS",
  "fullName": "Conference on Neural Information Processing Systems",
  "year": 2026,
  "field": "AI/ML",
  "tags": [
    "machine-learning",
    "deep-learning",
    "ai",
    "statistics"
  ],
  "deadline": "2026-05-06T23:59:59",
  "abstractDeadline": "2026-05-04T23:59:59",
  "location": "Sydney, Australia",
  "website": "https://neurips.cc/Conferences/2026",
  "weight": 22,
  "featured": true,
  "updatedAt": "2026-07-30"
}
