{
  "id": "iclr-2027",
  "name": "ICLR",
  "fullName": "International Conference on Learning Representations",
  "year": 2027,
  "field": "AI/ML",
  "tags": [
    "machine-learning",
    "deep-learning",
    "representation-learning"
  ],
  "deadline": "2026-09-25T23:59:59",
  "abstractDeadline": "2026-09-18T23:59:59",
  "location": "TBA",
  "website": "https://iclr.cc/Conferences/2027",
  "weight": 18,
  "featured": true,
  "updatedAt": "2026-07-30"
}
