{
  "id": "acl-2027",
  "name": "ACL",
  "fullName": "Annual Meeting of the Association for Computational Linguistics",
  "year": 2027,
  "field": "NLP",
  "tags": [
    "nlp",
    "llm",
    "speech"
  ],
  "deadline": "2027-02-15",
  "location": "Prague, Czechia",
  "website": "https://www.aclweb.org",
  "weight": 12,
  "featured": false,
  "updatedAt": "2026-07-30"
}
