{
  "id": "ismar-2026",
  "name": "ISMAR",
  "fullName": "International Symposium on Mixed and Augmented Reality",
  "year": 2026,
  "field": "XR",
  "tags": [
    "ar-vr",
    "hci",
    "computer-vision"
  ],
  "deadline": "2026-08-19",
  "location": "Taipei, Taiwan",
  "website": "https://ismar.net",
  "weight": 5,
  "featured": false,
  "updatedAt": "2026-07-30"
}
