{
  "id": "sigcomm-2027",
  "name": "SIGCOMM",
  "fullName": "ACM Special Interest Group on Data Communication",
  "year": 2027,
  "field": "SYSTEMS",
  "tags": [
    "networking",
    "systems"
  ],
  "deadline": "2027-01-30",
  "location": "Porto, Portugal",
  "website": "https://sigcomm.org",
  "weight": 7,
  "featured": false,
  "updatedAt": "2026-07-30"
}
