{
  "id": "confname-2027",
  "name": "CONFNAME",
  "fullName": "Full Official Conference Name",
  "year": 2027,
  "field": "AI",
  "tags": [
    "machine-learning"
  ],
  "deadline": "2026-12-31T23:59:59",
  "location": "City, Country",
  "website": "https://example.org",
  "weight": 8,
  "featured": false,
  "updatedAt": "2026-07-30"
}
